,Text,Sentiment,Timestamp,User,Platform,Hashtags,Retweets,Likes,Country,Year,Month,Day,Hour,Total_Interaction,User Type,User ID,Country ID,Classified Sentiment,Platform ID
357,Nostalgic memories flood in while revisiting childhood favorites,Nostalgia,2017-01-28 21:15:00,ChildhoodMemories,Facebook,#Nostalgia #ChildhoodFavorites,20,40,Australia,2017,1,28,21,60,Influencer,User_358,AU,Negative,FB
358,Appreciation for the vibrant culture experienced during travel,Appreciation,2016-11-14 13:45:00,CultureExplorer,Twitter,#Appreciation #CulturalExperience,28,55,UK,2016,11,14,13,83,Influencer,User_359,UK,Negative,X
359,Confidence soars after overcoming public speaking anxiety,Confidence,2020-04-02 17:30:00,PublicSpeaker,Instagram,#Confidence #OvercomingAnxiety,15,30,USA,2020,4,2,17,45,Regular User,User_360,US,Negative,IG
360,Contentment in the midst of a family gathering filled with laughter,Contentment,2023-01-15 19:00:00,FamilyCelebration,Facebook,#Contentment #FamilyLaughter,25,50,Canada,2023,1,15,19,75,Influencer,User_361,CA,Negative,FB
361,Enthusiasm for learning new skills and expanding knowledge,Enthusiasm,2018-08-07 12:15:00,LifelongLearner,Twitter,#Enthusiasm #SkillBuilding,30,60,India,2018,8,7,12,90,Influencer,User_362,IN,Negative,X
362,Surprise and delight at discovering a hidden gem in the city,Surprise,2019-10-18 16:45:00,CityExplorer,Instagram,#Surprise #HiddenGem,18,35,UK,2019,10,18,16,53,Influencer,User_363,UK,Negative,IG
363,A sense of accomplishment after completing a challenging workout,Accomplishment,2022-06-30 07:00:00,FitnessAchiever,Facebook,#Accomplishment #FitnessSuccess,22,45,Australia,2022,6,30,7,67,Influencer,User_364,AU,Negative,FB
364,Wonderment at the beauty of a double rainbow after the rain,Wonderment,2017-06-12 18:20:00,RainbowChaser,Twitter,#Wonderment #DoubleRainbow,35,70,USA,2017,6,12,18,105,Influencer,User_365,US,Negative,X
365,Optimism for a bright future amidst challenging times,Optimism,2021-07-05 09:30:00,FutureOptimist,Instagram,#Optimism #BrightFuture,20,40,Canada,2021,7,5,9,60,Influencer,User_366,CA,Negative,IG
366,Pride in achieving a personal milestone in career progression,Pride,2016-04-15 14:50:00,CareerAchiever,Facebook,#Pride #CareerMilestone,28,55,UK,2016,4,15,14,83,Influencer,User_367,UK,Negative,FB
367,Happiness blooms like flowers in a garden on a sunny day,Happiness,2020-02-10 11:15:00,SunnyDayEnthusiast,Twitter,#Happiness #SunnyDay,15,30,India,2020,2,10,11,45,Regular User,User_368,IN,Positive,X
368,Elation over discovering a rare book in a quaint bookstore,Elation,2018-09-22 16:30:00,Bookworm,Instagram,#Elation #RareBookDiscovery,40,80,USA,2018,9,22,16,120,Influencer,User_369,US,Negative,IG
369,Curiosity piqued by the mysteries of an ancient archaeological site,Curiosity,2015-11-08 10:00:00,ArchaeologyEnthusiast,Facebook,#Curiosity #AncientMysteries,18,35,Australia,2015,11,8,10,53,Influencer,User_370,AU,Negative,FB
370,Mesmerized by the cosmic dance of fireflies on a moonlit night,Enchantment,2022-08-10 22:00:00,NightSkyObserver,Instagram,#Enchantment #CosmicFireflies,25,50,Brazil,2022,8,10,22,75,Influencer,User_371,BR,Negative,IG
371,Intrigued by the symphony of colors in an abstract art exhibition,Intrigue,2019-04-05 17:30:00,ArtConnoisseur,Twitter,#Intrigue #AbstractArt,18,35,France,2019,4,5,17,53,Influencer,User_372,FR,Negative,X
372,Giggles and joy echo in the air during a childrens playdate,PlayfulJoy,2020-12-15 15:45:00,PlayfulParent,Facebook,#PlayfulJoy #ChildrensPlaydate,22,45,Japan,2020,12,15,15,67,Influencer,User_373,JP,Negative,FB
373,Enveloped in serenity while practicing mindfulness by the lake,Mindfulness,2017-10-20 08:15:00,ZenSeeker,Instagram,#Mindfulness #LakeTranquility,35,70,Canada,2017,10,20,8,105,Influencer,User_374,CA,Negative,IG
374,Chasing dreams like a kite soaring high in the vast open sky,DreamChaser,2021-02-28 13:00:00,SkyDreamer,Twitter,#DreamChaser #SkyHighDreams,30,60,Australia,2021,2,28,13,90,Influencer,User_375,AU,Negative,X
375,Spellbound by the elegance of a ballroom dance under crystal chandeliers,Elegance,2018-06-12 20:30:00,DanceEnthusiast,Facebook,#Elegance #BallroomDance,28,55,UK,2018,6,12,20,83,Influencer,User_376,UK,Negative,FB
376,Whimsical delight in a world of fairy tales and magical creatures,Whimsy,2016-03-08 14:20:00,FairyTaleExplorer,Instagram,#Whimsy #MagicalWorld,20,40,USA,2016,3,8,14,60,Influencer,User_377,US,Negative,IG
377,Pensive contemplation amid the ancient ruins of a forgotten civilization,Pensive,2023-04-18 17:10:00,RuinsExplorer,Twitter,#Pensive #AncientCivilization,18,35,Greece,2023,4,18,17,53,Influencer,User_378,GR,Negative,X
378,Embracing the thrill of speed on a rollercoasters exhilarating twists,Thrill,2020-07-25 12:45:00,RollercoasterFan,Facebook,#Thrill #RollercoasterAdventure,22,45,Germany,2020,7,25,12,67,Influencer,User_379,DE,Negative,FB
379,Harmony resonates as musicians play a melody of unity and togetherness,Harmony,2019-11-30 19:30:00,MusicHarmonist,Instagram,#Harmony #MusicalUnity,35,70,Sweden,2019,11,30,19,105,Influencer,User_380,SE,Negative,IG
380,A burst of creativity in the quiet solitude of an artists studio,Creativity,2015-09-01 16:00:00,StudioArtist,Twitter,#Creativity #ArtistsHaven,15,30,Italy,2015,9,1,16,45,Regular User,User_381,IT,Negative,X
381,Radiant joy akin to blooming flowers on a sunkissed spring morning,Radiance,2022-05-05 10:15:00,SpringEnthusiast,Facebook,#Radiance #SpringBlooms,25,50,Netherlands,2022,5,5,10,75,Influencer,User_382,NL,Negative,FB
382,A sense of wonder at the vastness of the cosmos on a stargazing night,Wonder,2018-07-08 23:00:00,CosmosExplorer,Instagram,#Wonder #StargazingAdventure,40,80,South Africa,2018,7,8,23,120,Influencer,User_383,ZA,Negative,IG
383,Rejuvenated by the salty breeze and the sound of waves at the seaside,Rejuvenation,2021-09-20 14:30:00,SeaBreezeLover,Twitter,#Rejuvenation #SeasideEscape,18,35,Spain,2021,9,20,14,53,Influencer,User_384,ES,Negative,X
384,Whispers of inspiration from the rustling leaves in a serene forest,Inspiration,2016-11-15 11:45:00,ForestDreamer,Facebook,#Inspiration #ForestWhispers,28,55,Portugal,2016,11,15,11,83,Influencer,User_385,PT,Negative,FB
385,Savoring the warmth of a cup of cocoa on a chilly winter evening,Coziness,2020-01-12 18:00:00,WinterWarmth,Instagram,#Coziness #WarmWinterEvening,30,60,Switzerland,2020,1,12,18,90,Influencer,User_386,CH,Negative,IG
386,Heartfelt gratitude for the laughter shared during a family reunion,Gratitude,2017-12-28 19:15:00,FamilyGatherer,Facebook,#Gratitude #FamilyLaughter,22,45,Austria,2017,12,28,19,67,Influencer,User_387,AT,Negative,FB
387,Embarking on a culinary adventure savoring exotic flavors around the world,Adventure,2019-03-02 20:20:00,CulinaryExplorer,Twitter,#Adventure #CulinaryJourney,35,70,Belgium,2019,3,2,20,105,Influencer,User_388,BE,Negative,X
388,Euphoria floods in as the final puzzle piece clicks into place,Euphoria,2022-06-08 15:30:00,PuzzleSolver,Instagram,#Euphoria #PuzzleCompletion,20,40,Denmark,2022,6,8,15,60,Influencer,User_389,DK,Negative,IG
389,Aweinspired by the grandeur of an ancient cathedrals intricate architecture,Awe,2018-08-18 14:45:00,CathedralVisitor,Facebook,#Awe #ArchitecturalGrandeur,18,35,Czech Republic,2018,8,18,14,53,Influencer,User_390,CZ,Negative,FB
390,Captivated by the ethereal beauty of a field filled with fireflies,Enchantment,2022-08-10 22:00:00,NightSkyObserver,Instagram,#Enchantment #FireflyField,25,50,Brazil,2022,8,10,22,75,Influencer,User_391,BR,Negative,IG
391,Immersed in the enchanting melodies of a street musicians violin,Melodic,2019-04-05 17:30:00,MusicLover,Twitter,#Melodic #StreetMusic,18,35,France,2019,4,5,17,53,Influencer,User_392,FR,Negative,X
392,Joyful laughter resonates through a lively summer carnival,FestiveJoy,2020-12-15 15:45:00,CarnivalGoer,Facebook,#FestiveJoy #SummerCarnival,22,45,Japan,2020,12,15,15,67,Influencer,User_393,JP,Negative,FB
393,Exploring the universe within during a mindful meditation session,InnerJourney,2017-10-20 08:15:00,MindfulExplorer,Instagram,#InnerJourney #MeditationBliss,35,70,Canada,2017,10,20,8,105,Influencer,User_394,CA,Negative,IG
394,Soaring like a free spirit on the winds of a coastal cliff,Freedom,2021-02-28 13:00:00,CoastalExplorer,Twitter,#Freedom #CoastalAdventure,30,60,Australia,2021,2,28,13,90,Influencer,User_395,AU,Negative,X
395,Dazzled by the elegance of a masquerade balls dazzling costumes,Dazzle,2018-06-12 20:30:00,MasqueradeAttendee,Facebook,#Dazzle #MasqueradeElegance,28,55,UK,2018,6,12,20,83,Influencer,User_396,UK,Negative,FB
396,Whimsical delight in a world of whimsical fairy tales,Whimsy,2016-03-08 14:20:00,FairyTaleAdventurer,Instagram,#Whimsy #FairyTaleMagic,20,40,USA,2016,3,8,14,60,Influencer,User_397,US,Negative,IG
397,Reflective contemplation amid the ruins of a forgotten era,Reflection,2023-04-18 17:10:00,RuinsExplorer,Twitter,#Reflection #ForgottenEra,18,35,Greece,2023,4,18,17,53,Influencer,User_398,GR,Negative,X
398,Riding the adrenaline rush on a rollercoasters wild twists,Adrenaline,2020-07-25 12:45:00,ThrillSeeker,Facebook,#Adrenaline #RollercoasterThrills,22,45,Germany,2020,7,25,12,67,Influencer,User_399,DE,Negative,FB
399,Harmony resonates as musicians play a symphony of unity,Harmony,2019-11-30 19:30:00,MusicHarmonist,Instagram,#Harmony #MusicalUnity,35,70,Sweden,2019,11,30,19,105,Influencer,User_400,SE,Negative,IG
400,A burst of artistic creativity in the quietude of an artists studio,ArtisticBurst,2015-09-01 16:00:00,StudioArtist,Twitter,#ArtisticBurst #StudioCreativity,15,30,Italy,2015,9,1,16,45,Regular User,User_401,IT,Negative,X
401,Radiant joy akin to blossoming flowers on a sunlit spring morning,Radiance,2022-05-05 10:15:00,SpringEnthusiast,Facebook,#Radiance #SpringBlooms,25,50,Netherlands,2022,5,5,10,75,Influencer,User_402,NL,Negative,FB
402,Aweinspired by the vastness of the cosmos on a stargazing night,Wonder,2018-07-08 23:00:00,CosmosExplorer,Instagram,#Wonder #StargazingAdventure,40,80,South Africa,2018,7,8,23,120,Influencer,User_403,ZA,Negative,IG
403,Rejuvenated by the salty breeze and the sound of waves at the seaside,Rejuvenation,2021-09-20 14:30:00,SeaBreezeLover,Twitter,#Rejuvenation #SeasideEscape,18,35,Spain,2021,9,20,14,53,Influencer,User_404,ES,Negative,X
404,Whispers of inspiration from the rustling leaves in a serene forest,Inspiration,2016-11-15 11:45:00,ForestDreamer,Facebook,#Inspiration #ForestWhispers,28,55,Portugal,2016,11,15,11,83,Influencer,User_405,PT,Negative,FB
405,Savoring the warmth of a cup of cocoa on a chilly winter evening,Coziness,2020-01-12 18:00:00,WinterWarmth,Instagram,#Coziness #WarmWinterEvening,30,60,Switzerland,2020,1,12,18,90,Influencer,User_406,CH,Negative,IG
406,Heartfelt gratitude for the laughter shared during a family reunion,Gratitude,2017-12-28 19:15:00,FamilyGatherer,Facebook,#Gratitude #FamilyLaughter,22,45,Austria,2017,12,28,19,67,Influencer,User_407,AT,Negative,FB
407,Embarking on a culinary odyssey savoring flavors around the world,CulinaryOdyssey,2019-03-02 20:20:00,CulinaryExplorer,Twitter,#CulinaryOdyssey #FlavorsAroundTheWorld,35,70,Belgium,2019,3,2,20,105,Influencer,User_408,BE,Negative,X
408,Euphoria floods in as the final puzzle piece fits perfectly,Euphoria,2022-06-08 15:30:00,PuzzleSolver,Instagram,#Euphoria #PerfectPuzzle,20,40,Denmark,2022,6,8,15,60,Influencer,User_409,DK,Negative,IG
409,Awestruck by the grandeur of an ancient cathedrals intricate architecture,Awe,2018-08-18 14:45:00,CathedralVisitor,Facebook,#Awe #ArchitecturalGrandeur,18,35,Czech Republic,2018,8,18,14,53,Influencer,User_410,CZ,Negative,FB
410,Curiosity awakened by the mysteries of an ancient archaeological site,Curiosity,2015-11-08 10:00:00,ArchaeologyEnthusiast,Instagram,#Curiosity #AncientMysteries,18,35,Australia,2015,11,8,10,53,Influencer,User_411,AU,Negative,IG
411,Giddy with excitement as the first snowflakes dance from the sky,Excitement,2020-12-02 17:30:00,SnowfallEnthusiast,Twitter,#Excitement #SnowfallMagic,22,45,Canada,2020,12,2,17,67,Influencer,User_412,CA,Negative,X
412,Contentment envelops as the aroma of freshly baked bread fills the air,Contentment,2017-06-10 12:15:00,BreadLover,Instagram,#Contentment #FreshBreadAroma,28,55,France,2017,6,10,12,83,Influencer,User_413,FR,Negative,IG
413,Inspired by the resilience of a lone tree standing tall in a storm,Resilience,2021-04-15 14:20:00,NatureResilient,Facebook,#Resilience #StandingTall,35,70,USA,2021,4,15,14,105,Influencer,User_414,US,Negative,FB
414,Lost in the pages of a captivating novel transported to another world,Immersion,2019-09-28 19:45:00,Bookworm,Twitter,#Immersion #CaptivatingNovel,20,40,UK,2019,9,28,19,60,Influencer,User_415,UK,Negative,X
415,Drenched in nostalgia while flipping through an old family photo album,Nostalgia,2016-12-05 21:00:00,FamilyHistorian,Instagram,#Nostalgia #FamilyPhotoAlbum,25,50,India,2016,12,5,21,75,Influencer,User_416,IN,Negative,IG
416,Spark of inspiration ignites like a shooting star in the night sky,Spark,2018-02-10 23:30:00,NightSkyWatcher,Facebook,#Spark #InspirationIgnited,30,60,Australia,2018,2,10,23,90,Influencer,User_417,AU,Negative,FB
417,Imbued with gratitude for the simple pleasure of a warm cup of tea,Gratitude,2023-02-15 08:30:00,TeaEnthusiast,Twitter,#Gratitude #WarmTea,18,35,Japan,2023,2,15,8,53,Influencer,User_418,JP,Negative,X
418,Marveling at the kaleidoscope of colors in a vibrant street market,Marvel,2015-08-22 15:00:00,MarketExplorer,Instagram,#Marvel #ColorfulStreetMarket,22,45,Brazil,2015,8,22,15,67,Influencer,User_419,BR,Negative,IG
419,Awash with serenity as the sun sets over a tranquil lakeside retreat,Serenity,2020-11-20 18:45:00,LakesideRetreater,Facebook,#Serenity #TranquilSunset,28,55,Germany,2020,11,20,18,83,Influencer,User_420,DE,Negative,FB
420,Drowning in sorrow as memories of lost love resurface,Heartbreak,2019-08-05 21:00:00,LostInLove,Instagram,#Heartbreak #LostLove,15,30,USA,2019,8,5,21,45,Regular User,User_421,US,Negative,IG
421,Numbness sets in as the weight of loneliness grows heavier,Loneliness,2021-02-12 16:45:00,SolitudeSeeker,Twitter,#Loneliness #HeavyHeart,18,35,Canada,2021,2,12,16,53,Influencer,User_422,CA,Negative,X
422,Tears fall like raindrops mourning the end of a cherished friendship,Grief,2020-11-28 14:20:00,FriendshipsEnd,Facebook,#Grief #LostFriendship,22,45,UK,2020,11,28,14,67,Influencer,User_423,UK,Negative,FB
423,Despair clouds the mind feeling adrift in an endless sea of darkness,Despair,2016-05-15 22:30:00,LostInDarkness,Instagram,#Despair #EndlessDarkness,28,55,Australia,2016,5,15,22,83,Influencer,User_424,AU,Negative,IG
424,Shattered by betrayal trust crumbles like fragile glass,Betrayal,2018-09-10 13:15:00,BrokenTrust,Twitter,#Betrayal #ShatteredTrust,22,45,Germany,2018,9,10,13,67,Influencer,User_425,DE,Negative,X
425,Aching heart the symphony of pain plays in the silence of solitude,Suffering,2022-03-20 19:30:00,SilentSufferer,Facebook,#Suffering #HeartacheSymphony,25,50,Brazil,2022,3,20,19,75,Influencer,User_426,BR,Negative,FB
426,Emotional storm a whirlwind of sadness engulfs every thought,EmotionalStorm,2017-07-18 17:45:00,StormyFeelings,Instagram,#EmotionalStorm #SadnessWhirlwind,30,60,India,2017,7,18,17,90,Influencer,User_427,IN,Negative,IG
427,Haunted by regrets the ghost of the past lingers relentlessly,Regret,2018-12-15 10:00:00,LingeringGhost,Twitter,#Regret #HauntedPast,18,35,France,2018,12,15,10,53,Influencer,User_428,FR,Negative,X
428,Torn apart by grief the echoes of loss reverberate through the soul,Grief,2015-06-28 21:15:00,EchoesOfLoss,Facebook,#Grief #TornApart,28,55,Italy,2015,6,28,21,83,Influencer,User_429,IT,Negative,FB
429,Isolation deepens an emotional winter where warmth is but a distant memory,Isolation,2020-04-02 14:20:00,WinterOfEmotions,Instagram,#Isolation #EmotionalWinter,35,70,Japan,2020,4,2,14,105,Influencer,User_430,JP,Negative,IG
430,Soulcrushing disappointment hopes shattered like fragile glass,Disappointment,2019-10-08 18:30:00,ShatteredHopes,Twitter,#Disappointment #CrushedHopes,20,40,Spain,2019,10,8,18,60,Influencer,User_431,ES,Negative,X
431,Painful echoes of a love once cherished now lost in the abyss of time,LostLove,2016-11-22 09:45:00,AbyssOfTime,Facebook,#LostLove #PainfulEchoes,22,45,Netherlands,2016,11,22,9,67,Influencer,User_432,NL,Negative,FB
432,Heartache deepens a solitary journey through the abyss of despair,Despair,2022-08-18 22:00:00,SolitaryDescent,Instagram,#Despair #AbyssOfHeartache,40,80,South Africa,2022,8,18,22,120,Influencer,User_433,ZA,Negative,IG
433,Melancholy lingers a bittersweet serenade in the quietude of solitude,Melancholy,2017-03-12 23:30:00,SerenadeOfSolitude,Twitter,#Melancholy #QuietSerenade,18,35,UK,2017,3,12,23,53,Influencer,User_434,UK,Negative,X
434,Bitterness like a poison seeping into every crevice of the wounded heart,Bitterness,2015-12-15 16:15:00,PoisonedHeart,Facebook,#Bitterness #WoundedHeart,25,50,Australia,2015,12,15,16,75,Influencer,User_435,AU,Negative,FB
435,Emotional exhaustion the weight of the world crushing weary shoulders,Exhaustion,2021-09-05 13:30:00,WearySoulCrushed,Instagram,#Exhaustion #CrushedSpirit,35,70,Canada,2021,9,5,13,105,Influencer,User_436,CA,Negative,IG
436,Sorrowful echoes a symphony of pain played by the strings of loss,Sorrow,2018-05-22 20:45:00,StringsOfSorrow,Twitter,#Sorrow #SymphonyOfLoss,18,35,Germany,2018,5,22,20,53,Influencer,User_437,DE,Negative,X
437,Darkness descends engulfing the soul in the shadows of despair,Darkness,2016-07-10 18:20:00,SoulInShadow,Facebook,#Darkness #SoulEngulfed,28,55,USA,2016,7,10,18,83,Influencer,User_438,US,Negative,FB
438,Desperation whispers the silent plea for a glimmer of hope in the abyss,Desperation,2019-04-30 14:00:00,WhisperedDespair,Instagram,#Desperation #GlimmerOfHope,22,45,France,2019,4,30,14,67,Influencer,User_439,FR,Negative,IG
439,Heart in ruins the remnants of shattered dreams scattered in the wind,Ruins,2022-01-08 11:30:00,DreamsInWind,Twitter,#Ruins #ShatteredDreams,20,40,Brazil,2022,1,8,11,60,Influencer,User_440,BR,Negative,X
440,Shattered by the echoes of a shattered dream fragments of hope scattered,Desolation,2017-09-10 19:15:00,DreamEchoes,Twitter,#Desolation #ScatteredHope,20,40,Australia,2017,9,10,19,60,Influencer,User_441,AU,Negative,X
441,Avoiding the thorns of regret walking barefoot on the path of remorse,Regret,2022-04-18 11:30:00,RemorseWalker,Instagram,#Regret #PathOfRemorse,25,50,Canada,2022,4,18,11,75,Influencer,User_442,CA,Negative,IG
442,In the labyrinth of grief the walls echo with the footsteps of lost joy,Grief,2018-12-05 21:45:00,JoyLabyrinth,Facebook,#Grief #LostJoyFootsteps,18,35,USA,2018,12,5,21,53,Influencer,User_443,US,Negative,FB
443,A soul adrift in the sea of solitude waves of loneliness crashing relentlessly,Loneliness,2016-06-28 14:20:00,SolitudeSeas,Twitter,#Loneliness #CrashingWaves,22,45,UK,2016,6,28,14,67,Influencer,User_444,UK,Negative,X
444,The bitterness of betrayal a taste that lingers staining the palate of trust,Bitterness,2019-10-22 17:00:00,PalateStainer,Instagram,#Bitterness #StainedTrust,15,30,Germany,2019,10,22,17,45,Regular User,User_445,DE,Negative,IG
445,In the ruins of hope echoes of shattered dreams whisper tales of loss,Desolation,2021-03-15 22:45:00,HopeRuins,Facebook,#Desolation #WhisperedLoss,28,55,Brazil,2021,3,15,22,83,Influencer,User_446,BR,Negative,FB
446,Sinking like a stone in the ocean of heartbreak each ripple a sigh of despair,Heartbreak,2017-08-10 19:30:00,OceanSinker,Twitter,#Heartbreak #RippleOfDespair,22,45,France,2017,8,10,19,67,Influencer,User_447,FR,Negative,X
447,Tears the ink staining the pages of a journal a testament to silent grief,Grief,2023-01-28 14:30:00,InkJournalist,Instagram,#Grief #SilentTears,30,60,India,2023,1,28,14,90,Influencer,User_448,IN,Negative,IG
448,In the wasteland of lost trust the echoes of broken promises reverberate,Betrayal,2016-12-12 10:00:00,TrustWasteland,Facebook,#Betrayal #ReverberatingPromises,25,50,Italy,2016,12,12,10,75,Influencer,User_449,IT,Negative,FB
449,Avoiding the shards of shattered dreams walking the tightrope of resilience,Resilience,2020-07-18 15:15:00,DreamTightrope,Twitter,#Resilience #TightropeWalk,35,70,Japan,2020,7,18,15,105,Influencer,User_450,JP,Negative,X
450,Suffocating in the silence of solitude where echoes of laughter once thrived,Isolation,2022-05-20 20:30:00,EchoedLaughter,Instagram,#Isolation #SilentSolitude,30,60,South Africa,2022,5,20,20,90,Influencer,User_451,ZA,Negative,IG
451,Haunted by the specter of lost possibilities a ghost that refuses to fade away,Regret,2019-11-08 14:45:00,PossibilityGhost,Twitter,#Regret #FadingPossibilities,18,35,Spain,2019,11,8,14,53,Influencer,User_452,ES,Negative,X
452,In the labyrinth of despair the echoes of a broken heart reverberate endlessly,Despair,2017-03-28 22:00:00,EndlessLabyrinth,Facebook,#Despair #EndlessReverberation,28,55,Australia,2017,3,28,22,83,Influencer,User_453,AU,Negative,FB
453,Sinking like autumn leaves in the river of sorrow carried away by the current,Sorrow,2020-09-15 18:15:00,RiverOfSorrow,Instagram,#Sorrow #AutumnLeaves,22,45,Canada,2020,9,15,18,67,Influencer,User_454,CA,Negative,IG
454,In the garden of broken dreams petals fall a silent testimony to shattered hopes,Desolation,2018-06-10 13:30:00,DreamGardener,Twitter,#Desolation #ShatteredHopes,20,40,UK,2018,6,10,13,60,Influencer,User_455,UK,Negative,X
455,Tears the currency of grief spent in the marketplace of lost love and longing,Grief,2016-12-22 21:45:00,CurrencyOfTears,Facebook,#Grief #LostLoveLonging,25,50,USA,2016,12,22,21,75,Influencer,User_456,US,Negative,FB
456,Wandering in the maze of betrayal the walls closing in with every wrong turn,Betrayal,2021-01-05 16:20:00,MazeWanderer,Instagram,#Betrayal #ClosingWalls,15,30,Germany,2021,1,5,16,45,Regular User,User_457,DE,Negative,IG
457,A soul weathered by the storm of heartbreak seeking refuge in the calm after,Heartbreak,2019-04-18 11:00:00,StormSeeker,Twitter,#Heartbreak #CalmAfterStorm,22,45,Brazil,2019,4,18,11,67,Influencer,User_458,BR,Negative,X
458,In the tapestry of despair threads of hope unravel leaving a portrait of sorrow,Despair,2017-08-28 19:30:00,TapestrySorrow,Facebook,#Despair #UnraveledHope,18,35,India,2017,8,28,19,53,Influencer,User_459,IN,Negative,FB
459,Like a withered rose in the garden of love petals fall a silent surrender to time,Loss,2023-02-10 14:30:00,WitheredRose,Instagram,#Loss #SilentSurrender,28,55,France,2023,2,10,14,83,Influencer,User_460,FR,Negative,IG
460,In the void of heartache echoes of a love song play each note a pang of longing,Heartache,2022-07-10 22:15:00,LoveSongEcho,Instagram,#Heartache #LoveSongLonging,30,60,Japan,2022,7,10,22,90,Influencer,User_461,JP,Negative,IG
461,Nostalgia a bittersweet dance in the moonlit ballroom of cherished memories,Nostalgia,2019-05-15 21:30:00,MoonlitMemories,Twitter,#Nostalgia #CherishedMemories,18,35,Italy,2019,5,15,21,53,Influencer,User_462,IT,Negative,X
462,In the symphony of grief each tear is a note composing a melancholic melody,Grief,2018-11-28 14:00:00,SymphonyOfTears,Facebook,#Grief #MelancholicMelody,22,45,Germany,2018,11,28,14,67,Influencer,User_463,DE,Negative,FB
463,Betrayal a venomous serpent slithering through the garden of trust poisoning roots,Betrayal,2021-03-02 17:45:00,VenomousGarden,Instagram,#Betrayal #PoisonedTrust,25,50,Canada,2021,3,2,17,75,Influencer,User_464,CA,Negative,IG
464,Sinking in the quicksand of despair the harder you fight the deeper you descend,Despair,2016-10-18 19:30:00,QuicksandFighter,Twitter,#Despair #DeepDescent,20,40,USA,2016,10,18,19,60,Influencer,User_465,US,Negative,X
465,Wandering through the cemetery of lost dreams tombstones marking untold sorrows,Desolation,2020-08-15 12:30:00,DreamCemetery,Facebook,#Desolation #UntoldSorrows,28,55,France,2020,8,15,12,83,Influencer,User_466,FR,Negative,FB
466,Swept away by the river of regret the currents of the past refusing to release,Regret,2017-04-28 16:20:00,RegretRiver,Instagram,#Regret #PastCurrents,18,35,UK,2017,4,28,16,53,Influencer,User_467,UK,Negative,IG
467,Whispers of lost love linger in the attic of the heart forgotten but not erased,Loss,2019-09-10 21:00:00,HeartAttic,Twitter,#Loss #ForgottenLove,22,45,Australia,2019,9,10,21,67,Influencer,User_468,AU,Negative,X
468,In the gallery of broken promises each shattered vow framed a painful exhibition,Betrayal,2022-01-28 13:45:00,PromiseGallery,Facebook,#Betrayal #ShatteredVows,15,30,Brazil,2022,1,28,13,45,Regular User,User_469,BR,Negative,FB
469,The echoes of solitude a silent conversation between a soul and its shadows,Solitude,2016-06-15 22:30:00,EchoedConversation,Instagram,#Solitude #ShadowConversation,30,60,Spain,2016,6,15,22,90,Influencer,User_470,ES,Negative,IG
470,Dancing on sunshine each step a celebration of the joy found in simple moments,Joy,2021-08-20 15:45:00,SunshineDancer,Instagram,#Joy #SimpleMoments,40,80,USA,2021,8,20,15,120,Influencer,User_471,US,Positive,IG
471,Laughter echoes in the air a chorus of happiness that lifts the spirit higher,Happiness,2018-04-12 18:30:00,EchoedLaughter,Twitter,#Happiness #SpiritLifter,35,70,Canada,2018,4,12,18,105,Influencer,User_472,CA,Positive,X
472,In the garden of contentment each bloom whispers tales of inner peace and joy,Contentment,2022-02-15 12:20:00,GardenOfJoy,Facebook,#Contentment #InnerPeace,25,50,UK,2022,2,15,12,75,Influencer,User_473,UK,Negative,FB
473,Chasing dreams under the vibrant sky a journey fueled by hope and enthusiasm,Enthusiasm,2019-10-28 14:15:00,DreamChaser,Instagram,#Enthusiasm #HopefulJourney,30,60,Australia,2019,10,28,14,90,Influencer,User_474,AU,Negative,IG
474,Serenading the stars with a heart full of gratitude a melody of thankfulness,Gratitude,2017-12-22 21:00:00,StarSerenader,Twitter,#Gratitude #ThankfulMelody,22,45,India,2017,12,22,21,67,Influencer,User_475,IN,Negative,X
